{
  "schemaVersion": "1.0.0",
  "eventId": "sim-system-timed-001",
  "eventType": "system.timed",
  "platform": "system",
  "source": { "adapter": "fixture", "eventId": "fixture-system-timed-001", "eventName": "timed-action.fired" },
  "receivedAt": "2026-07-16T16:00:00.250Z",
  "channel": { "id": "local", "name": "local" },
  "payload": {
    "timerId": "hydration-reminder",
    "timerName": "Hydration Reminder",
    "scheduleType": "session-interval",
    "scheduledAt": "2026-07-16T16:00:00.000Z",
    "firedAt": "2026-07-16T16:00:00.250Z",
    "occurrence": 3,
    "missedRuns": 0,
    "lateByMs": 250,
    "selectionMode": "shuffle-container",
    "selectedMessage": "Remember to drink some water!",
    "containerCycle": 1,
    "containerPosition": 3,
    "containerSize": 4,
    "creatorPayload": { "category": "wellness", "messageKey": "hydrate" },
    "targetProvider": "event-only",
    "targetPlatforms": []
  },
  "metadata": { "simulated": true }
}
