{
  "schemaVersion": "1.0.0",
  "eventId": "sim-facebook-chat-001",
  "eventType": "chat.message",
  "platform": "facebook",
  "source": { "adapter": "fixture", "eventId": "facebook-chat-source-001", "eventName": "ChatMessage" },
  "receivedAt": "2026-01-01T00:00:03.000Z",
  "channel": { "id": "fixture-channel", "name": "ExampleChannel" },
  "user": { "id": "facebook-fixture-user", "name": "example_viewer", "displayName": "Example Viewer", "roles": ["viewer"] },
  "payload": { "message": "Hello from a simulated Facebook fixture" },
  "metadata": { "simulated": true }
}
