{
  "schemaVersion": "1.0.0",
  "eventId": "sim-facebook-donation-001",
  "eventType": "engagement.donation",
  "platform": "facebook",
  "source": { "adapter": "fixture", "eventId": "facebook-source-001", "eventName": "Donation" },
  "receivedAt": "2026-01-01T00:00:08.000Z",
  "channel": { "name": "ExampleChannel" },
  "user": { "name": "example_supporter", "roles": ["viewer"] },
  "payload": { "amount": 10, "currency": "USD" },
  "metadata": { "simulated": true }
}
