{"schemaVersion":"1.0.0","eventId":"sim-youtube-command-001","eventType":"command.received","platform":"youtube","source":{"adapter":"fixture","eventId":"youtube-command-source-001","eventName":"Command"},"receivedAt":"2026-01-01T00:01:01.000Z","channel":{"id":"fixture-channel","name":"ExampleChannel"},"user":{"id":"fixture-mod","name":"example_mod","displayName":"Example Mod","roles":["moderator"]},"payload":{"command":"shoutout","invokedAs":"so","arguments":["ExampleViewer"],"rawInput":"!so ExampleViewer","prefix":"!","minimumRole":"moderator","allowBots":false},"metadata":{"simulated":true}}
